pi@koruza:~ $ i2cdetect -y 1
     0  1  2  3  4  5  6  7  8  9  a  b  c  d  e  f
00:          -- -- -- -- -- -- -- -- 0b -- -- -- --
10: -- -- -- -- -- -- -- -- -- -- -- -- -- -- -- --
20: -- -- -- -- -- -- -- -- -- -- -- -- -- -- -- --
30: -- -- -- -- -- -- 36 -- -- -- -- -- -- -- -- --
40: -- -- -- -- -- -- -- -- -- -- -- -- -- -- -- --
50: -- -- -- -- -- -- -- -- -- -- -- -- -- -- -- --
60: -- -- -- -- -- -- -- -- -- -- -- 6b -- -- -- --
70: -- -- -- -- -- -- -- --

pi@koruza:~ $ i2cdump -y 1 0x0b
No size specified (using byte-data access)
     0  1  2  3  4  5  6  7  8  9  a  b  c  d  e  f    0123456789abcdef
00: 67 77 30 fd 67 ff fe 98 b3 db 90 8f 46 15 2b 01    gw0?g.??????F?+?
10: 44 fe fe ff c4 c4 e1 01 70 50 ac 01 d0 ff ff ff    D??.????pP???...
20: 31 3f 7f fe ff ff ff ff ff ff ff ff ff ff ff ff    1???............
30: ff ff ff ff 8f b3 54 8f b4 8f 7c 8f 00 00 00 db    ....??T???|?...?
40: ff ff ff ff ff ff ff ff ff ff ff ff 00 00 00 db    ...............?
50: c6 49 04 ff ff ff ff ff ff d0 19 7a dc 47 86 5d    ?I?......??z?G?]
60: f3 c1 20 e8 85 ff ff df 57 19 ff e8 69 c8 00 68    ?? ??..?W?.?i?.h
70: ee ff ff ff ff ff ff ff ff ff ff ff 2d 00 06 cd    ?...........-.??
80: 00 00 00 00 00 00 00 00 00 00 00 00 00 00 00 00    ................
90: 00 00 00 00 00 00 00 00 00 00 00 00 00 00 00 02    ...............?
a0: 00 80 04 85 00 b8 70 3d 00 b8 00 7f ff 7f 00 00    .???.?p=.?.?.?..
b0: 00 04 00 00 00 01 00 41 00 06 0a 02 26 ff 10 00    .?...?.A.???&.?.
c0: 00 00 00 00 00 00 00 00 00 25 00 00 00 00 00 e8    .........%.....?
d0: 00 00 e3 00 00 00 00 00 00 00 00 00 00 00 00 00    ..?.............
e0: 8a 5a ee 71 a3 06 16 bc c3 ac 19 88 34 2b c3 fe    ?Z?q????????4+??
f0: 3d ff 81 00 fd 41 4e 01 16 3d 00 00 6d 1d 7c 1e    =.?.?AN??=..m?|?

pi@koruza:~ $ i2cdump -y 1 0x36
No size specified (using byte-data access)
     0  1  2  3  4  5  6  7  8  9  a  b  c  d  e  f    0123456789abcdef
00: 82 00 6d 6d 6d 00 82 47 70 b6 49 4c 2c c4 ff 67    ?.mmm.?Gp?IL,?.g
10: 8c ff 00 00 77 00 5d 06 b8 c2 14 b2 fe 14 e8 3b    ?...w.]????????;
20: ff e1 80 9d 00 05 62 d0 32 a4 39 70 56 a4 00 00    .???.?b?2?9pV?..
30: b3 bf 04 ff 52 63 00 e0 70 3d 61 91 68 28 f1 00    ???.Rc.?p=a?h(?.
40: 59 73 85 00 c6 6b 7d 82 25 34 0c 23 9f b2 e2 b8    Ys?.?k}?%4?#????
50: 80 f9 01 c7 1c 01 34 14 83 14 8a 49 a4 bb e0 54    ??????4????I???T
60: 00 00 00 00 ff 00 00 00 00 00 00 00 00 ff ff ff    ................
70: ff ff ff ff ff ff ff ff ff ff ff ff ff ff 00 00    ................
80: 00 00 00 00 00 00 00 00 00 00 00 00 00 00 00 00    ................
90: 00 00 00 00 00 00 00 00 00 00 00 00 00 00 00 00    ................
a0: 00 00 00 00 00 00 00 00 00 00 00 00 00 00 00 00    ................
b0: 00 00 80 80 80 05 43 00 7d 88 0b 50 00 01 0a 00    ..????C.}??P.??.
c0: 7a 96 38 cb fe 45 22 66 3f 21 b4 f4 4d 53 82 91    z?8??E"f?!??MS??
d0: d5 00 00 00 c2 00 00 00 b6 00 7b b6 32 ff ff 35    ?...?...?.{?2..5
e0: 74 41 ec 94 94 00 00 16 dc 28 0c 00 ec 80 a0 10    tA???..??(?.????
f0: 00 40 00 00 00 10 00 cc bc dd 66 ef 68 10 b6 3b    .@...?.???f?h??;

pi@koruza:~ $ i2cdump -y 1 0x6b
No size specified (using byte-data access)
     0  1  2  3  4  5  6  7  8  9  a  b  c  d  e  f    0123456789abcdef
00: 37 1b 60 11 b2 9c 73 4b 84 8a 20 ff ff ff ff ff    7?`???sK?? .....
10: ff ff ff ff ff ff ff ff ff ff ff ff ff ff ff ff    ................
20: ff ff ff ff ff ff ff ff ff ff ff ff ff ff ff ff    ................
30: ff ff ff ff ff ff ff ff ff ff ff ff ff ff ff ff    ................
40: ff ff ff ff ff ff ff ff ff ff ff ff ff ff ff ff    ................
50: ff ff ff ff ff ff ff ff ff ff ff ff ff ff ff ff    ................
60: ff ff ff ff ff ff ff ff ff ff ff ff ff ff ff ff    ................
70: ff ff ff ff ff ff ff ff ff ff ff ff ff ff ff ff    ................
80: ff ff ff ff ff ff ff ff ff ff ff ff ff ff ff ff    ................
90: ff ff ff ff ff ff ff ff ff ff ff ff ff ff ff ff    ................
a0: ff ff ff ff ff ff ff ff ff ff ff ff ff ff ff ff    ................
b0: ff ff ff ff ff ff ff ff ff ff ff ff ff ff ff ff    ................
c0: ff ff ff ff ff ff ff ff ff ff ff ff ff ff ff ff    ................
d0: ff ff ff ff ff ff ff ff ff ff ff ff ff ff ff ff    ................
e0: ff ff ff ff ff ff ff ff ff ff ff ff ff ff ff ff    ................
f0: ff ff ff ff ff ff ff ff ff ff ff ff ff ff ff ff    ................


